{
  "schemaVersion": 1,
  "snapshot": "2026-09-26",
  "sources": ["token-plan-overview", "base-url", "regions", "error-code", "context-cache"],
  "paths": {"openai": "/compatible-mode/v1", "anthropic": "/apps/anthropic", "native": "/api/v1"},
  "openApi": {
    "host": "modelstudio.ap-southeast-1.aliyuncs.com",
    "version": "2026-02-10",
    "sources": ["get-subscription-stats", "api-modelstudio-2026-02-10-getbillingoverview"]
  },
  "plans": {
    "token-plan-personal": {
      "family": "token-plan",
      "edition": "personal",
      "regions": ["ap-southeast-1"],
      "keyPrefix": "sk-sp-",
      "unit": "credits",
      "cycleDays": 30,
      "exhaustion": "blocking",
      "baseUrls": {
        "openai": "https://token-plan.ap-southeast-1.maas.aliyuncs.com/compatible-mode/v1",
        "anthropic": "https://token-plan.ap-southeast-1.maas.aliyuncs.com/apps/anthropic",
        "native": "https://token-plan.ap-southeast-1.maas.aliyuncs.com/api/v1"
      },
      "tiers": {
        "lite": {"credits": 11500, "concurrency": [1, 2]},
        "essential": {"credits": 25500, "concurrency": [2, 3]},
        "standard": {"credits": 45000, "concurrency": [3, 4]},
        "pro": {"credits": 180000, "concurrency": [6, 8]}
      },
      "sources": ["token-plan-overview", "token-plan-personal-overview", "token-plan-personal-faq", "token-plan-personal-quick-start"]
    },
    "token-plan-team": {
      "family": "token-plan",
      "edition": "team",
      "regions": ["ap-southeast-1"],
      "keyPrefix": "sk-sp-",
      "unit": "credits",
      "cycleDays": 30,
      "exhaustion": "blocking",
      "baseUrls": {
        "openai": "https://token-plan.ap-southeast-1.maas.aliyuncs.com/compatible-mode/v1",
        "anthropic": "https://token-plan.ap-southeast-1.maas.aliyuncs.com/apps/anthropic",
        "native": "https://token-plan.ap-southeast-1.maas.aliyuncs.com/api/v1"
      },
      "tiers": {
        "standard": {"credits": 25000, "concurrency": null},
        "advanced": {"credits": 100000, "concurrency": null},
        "premium": {"credits": 250000, "concurrency": null}
      },
      "sources": ["token-plan-team-overview", "token-plan-team-faq", "token-plan-team-quickstart"]
    },
    "pay-as-you-go": {
      "family": "pay-as-you-go",
      "edition": null,
      "regions": ["ap-southeast-1", "cn-beijing", "us-east-1", "eu-central-1", "ap-northeast-1", "cn-hongkong"],
      "keyPrefix": null,
      "unit": "usd",
      "cycleDays": null,
      "exhaustion": "billing",
      "baseUrls": null,
      "tiers": null,
      "sources": ["get-api-key", "regions", "base-url", "budget-management"]
    }
  },
  "regions": {
    "ap-southeast-1": {"workspaceHost": "{workspace}.ap-southeast-1.maas.aliyuncs.com", "legacyHost": "dashscope-intl.aliyuncs.com", "priced": true},
    "cn-beijing": {"workspaceHost": "{workspace}.cn-beijing.maas.aliyuncs.com", "legacyHost": "dashscope.aliyuncs.com", "priced": false},
    "us-east-1": {"workspaceHost": "{workspace}.us-east-1.maas.aliyuncs.com", "legacyHost": "dashscope-us.aliyuncs.com", "priced": false},
    "eu-central-1": {"workspaceHost": "{workspace}.eu-central-1.maas.aliyuncs.com", "legacyHost": null, "priced": false},
    "ap-northeast-1": {"workspaceHost": "{workspace}.ap-northeast-1.maas.aliyuncs.com", "legacyHost": null, "priced": false},
    "cn-hongkong": {"workspaceHost": "{workspace}.cn-hongkong.maas.aliyuncs.com", "legacyHost": "cn-hongkong.dashscope.aliyuncs.com", "priced": false}
  },
  "models": {
    "auto": {"kind": "text", "contextTokens": null, "maxInputTokens": null, "maxInputTokensThinking": null, "maxOutputTokens": null, "maxReasoningTokens": null, "inputs": ["text"], "reasoning": "router", "effort": null, "maxTokensIncludesReasoning": false, "eligibility": {"personal": true, "team": true, "payAsYouGo": false}, "prices": null, "sources": ["token-plan-personal-overview"]},
    "qwen3.8-max": {"kind": "text", "contextTokens": 1000000, "maxInputTokens": 991808, "maxInputTokensThinking": 983616, "maxOutputTokens": 131072, "maxReasoningTokens": 262144, "inputs": ["text", "image", "video"], "reasoning": "hybrid-on", "effort": {"param": "reasoning_effort", "values": ["xhigh", "medium", "low"], "default": "xhigh", "exclusiveWith": ["thinking_budget"]}, "maxTokensIncludesReasoning": false, "eligibility": {"personal": true, "team": true, "payAsYouGo": true}, "prices": {"input": "2", "output": "6", "cachedInput": "0.25"}, "sources": ["qwen3-8-max", "qwen-api-via-openai-chat-completions"]},
    "qwen3.8-flash": {"kind": "text", "contextTokens": 1000000, "maxInputTokens": 991808, "maxInputTokensThinking": 983616, "maxOutputTokens": 131072, "maxReasoningTokens": 262144, "inputs": ["text", "image", "video"], "reasoning": "hybrid-on", "effort": {"param": "reasoning_effort", "values": ["xhigh", "medium", "low"], "default": "xhigh", "exclusiveWith": ["thinking_budget"]}, "maxTokensIncludesReasoning": false, "eligibility": {"personal": true, "team": true, "payAsYouGo": true}, "prices": {"input": "0.15", "output": "0.47", "cachedInput": "0.016"}, "sources": ["qwen3-8-flash", "qwen-api-via-openai-chat-completions"]},
    "qwen3.7-max": {"kind": "text", "contextTokens": 1000000, "maxInputTokens": 991808, "maxInputTokensThinking": 983616, "maxOutputTokens": 131072, "maxReasoningTokens": null, "inputs": ["text"], "reasoning": "hybrid-on", "effort": null, "maxTokensIncludesReasoning": false, "eligibility": {"personal": true, "team": true, "payAsYouGo": true}, "prices": {"input": "2.5", "output": "7.5", "cachedInput": "0.5"}, "sources": ["qwen3-7-max"]},
    "qwen3.7-plus": {"kind": "text", "contextTokens": 1000000, "maxInputTokens": 991808, "maxInputTokensThinking": 983616, "maxOutputTokens": 131072, "maxReasoningTokens": null, "inputs": ["text", "image", "video"], "reasoning": "hybrid-on", "effort": null, "maxTokensIncludesReasoning": false, "eligibility": {"personal": true, "team": true, "payAsYouGo": true}, "prices": {"input": "0.4", "output": "1.6", "cachedInput": "0.08", "tiers": [{"aboveInputTokens": 256000, "input": "1.2", "output": "4.8", "cachedInput": "0.24"}]}, "sources": ["qwen3-7-plus"]},
    "qwen3.6-plus": {"kind": "text", "contextTokens": 1000000, "maxInputTokens": 991808, "maxInputTokensThinking": 983616, "maxOutputTokens": 65536, "maxReasoningTokens": 81920, "inputs": ["text", "image", "video"], "reasoning": "hybrid-on", "effort": null, "maxTokensIncludesReasoning": false, "eligibility": {"personal": false, "team": true, "payAsYouGo": true}, "prices": {"input": "0.5", "output": "3", "cachedInput": null, "tiers": [{"aboveInputTokens": 256000, "input": "2", "output": "6", "cachedInput": null}]}, "sources": ["qwen3-6-plus"]},
    "qwen3.6-flash": {"kind": "text", "contextTokens": 1000000, "maxInputTokens": 991808, "maxInputTokensThinking": 983616, "maxOutputTokens": 65536, "maxReasoningTokens": null, "inputs": ["text", "image", "video"], "reasoning": "hybrid-on", "effort": null, "maxTokensIncludesReasoning": false, "eligibility": {"personal": true, "team": true, "payAsYouGo": true}, "prices": {"input": "0.25", "output": "1.5", "cachedInput": null, "tiers": [{"aboveInputTokens": 256000, "input": "1", "output": "4", "cachedInput": null}]}, "sources": ["qwen3-6-flash"]},
    "deepseek-v4.1-flash": {"kind": "text", "contextTokens": 1000000, "maxInputTokens": 1000000, "maxInputTokensThinking": 1000000, "maxOutputTokens": 393216, "maxReasoningTokens": null, "inputs": ["text", "image"], "reasoning": "hybrid-on", "effort": {"param": "reasoning_effort", "values": ["max", "high", "low"], "default": "high", "exclusiveWith": []}, "maxTokensIncludesReasoning": true, "eligibility": {"personal": true, "team": true, "payAsYouGo": true}, "prices": {"input": "0.3", "output": "1.2", "cachedInput": "0.03", "note": "busy-hour prices; idle hours cost half"}, "sources": ["deepseek-v4-1-flash"]},
    "deepseek-v4-pro": {"kind": "text", "contextTokens": 1000000, "maxInputTokens": 1000000, "maxInputTokensThinking": 1000000, "maxOutputTokens": 393216, "maxReasoningTokens": null, "inputs": ["text"], "reasoning": "hybrid-on", "effort": null, "maxTokensIncludesReasoning": true, "eligibility": {"personal": true, "team": true, "payAsYouGo": true}, "prices": {"input": "2.4", "output": "4.8", "cachedInput": "0.2"}, "sources": ["deepseek-v4-pro"]},
    "deepseek-v4-pro-0813": {"kind": "text", "contextTokens": 1000000, "maxInputTokens": 1000000, "maxInputTokensThinking": 1000000, "maxOutputTokens": 393216, "maxReasoningTokens": null, "inputs": ["text"], "reasoning": "hybrid-on", "effort": null, "maxTokensIncludesReasoning": true, "eligibility": {"personal": true, "team": true, "payAsYouGo": true}, "prices": null, "sources": ["deepseek-v4-pro", "quota-management"]},
    "deepseek-v4-flash": {"kind": "text", "contextTokens": 1000000, "maxInputTokens": 1000000, "maxInputTokensThinking": 1000000, "maxOutputTokens": 393216, "maxReasoningTokens": null, "inputs": ["text"], "reasoning": "hybrid-on", "effort": null, "maxTokensIncludesReasoning": true, "eligibility": {"personal": false, "team": true, "payAsYouGo": true}, "prices": {"input": "0.2", "output": "0.4", "cachedInput": "0.04"}, "sources": ["deepseek-v4-flash"]},
    "deepseek-v4-flash-0731": {"kind": "text", "contextTokens": 1000000, "maxInputTokens": 1000000, "maxInputTokensThinking": 1000000, "maxOutputTokens": 393216, "maxReasoningTokens": null, "inputs": ["text"], "reasoning": "hybrid-on", "effort": null, "maxTokensIncludesReasoning": true, "eligibility": {"personal": true, "team": true, "payAsYouGo": true}, "prices": null, "sources": ["deepseek-v4-flash"]},